No.,Form Number,Form Name,URL,Form Link,Instructions Link,File Type,Description,Category,Features,Notes
1,AR-11,Alien's Change of Address Card,https://www.uscis.gov/ar-11,https://www.uscis.gov/sites/default/files/document/forms/ar-11.pdf,https://www.uscis.gov/sites/default/files/document/forms/ar-11instr.pdf,pdf,Change of address notification for immigrants,Administrative,form-assistance,Required within 10 days of moving
2,DS-157,Petition for Special Immigrant Classification for Afghan SIV Applicants,https://travel.state.gov/content/travel/en/us-visas/immigrate/special-immg-visa-afghans-employed-us-gov.html,N/A,N/A,html,For Afghan nationals who worked with U.S. government seeking SIV status,Special Immigrants,form-assistance,Filed with Department of State
3,DS-2019,Certificate of Eligibility for Exchange Visitor Status,https://j1visa.state.gov/participants/how-to-apply/about-ds-2019/,N/A,N/A,html,For J-1 exchange visitors,Nonimmigrant Visa,form-assistance,Issued by program sponsors
4,DS-260,Immigrant Visa Application,https://travel.state.gov/content/travel/en/us-visas/visa-information-resources/forms/ds-260-online-nonimmigrant-visa-application.html,N/A,N/A,html,Department of State visa application,Visa,form-assistance,Filed with U.S. consulates abroad
5,EOIR-26,Notice of Appeal to the Board of Immigration Appeals,https://www.justice.gov/eoir/media/1344261/dl?inline,https://www.justice.gov/eoir/file/eoir26/download,https://www.justice.gov/eoir/file/eoir26inst/download,pdf,Appeal of Immigration Judge decision,Appeals,form-assistance,Filed with Board of Immigration Appeals
6,EOIR-29,Notice of Appeal to the Board of Immigration Appeals from a Decision of a DHS Officer,https://www.justice.gov/eoir/page/file/1237856/dl?inline,https://www.justice.gov/eoir/file/eoir29/download,https://www.justice.gov/eoir/file/eoir29inst/download,pdf,Appeal of USCIS decision to the BIA,Appeals,form-assistance,For family-based visa petition denials
7,EOIR-42A,Application for Cancellation of Removal for Certain Permanent Residents,https://www.justice.gov/eoir/eoir-forms,https://www.justice.gov/eoir/file/eoir42a/download,https://www.justice.gov/eoir/file/eoir42ainst/download,pdf,Relief from removal for permanent residents,Relief from Removal,form-assistance,Filed in immigration court
8,EOIR-42B,Application for Cancellation of Removal for Non-Permanent Residents,https://www.justice.gov/eoir/eoir-forms,https://www.justice.gov/eoir/file/eoir42b/download,https://www.justice.gov/eoir/file/eoir42binst/download,pdf,Relief from removal for non-permanent residents,Relief from Removal,form-assistance,Filed in immigration court
9,G-1041,Genealogy Index Search Request,https://www.uscis.gov/g-1041,https://www.uscis.gov/sites/default/files/document/forms/g-1041.pdf,https://www.uscis.gov/sites/default/files/document/forms/g-1041instr.pdf,pdf,Search for historical immigration records,Administrative,form-assistance,For family history research
10,G-1041A,Genealogy Records Request,https://www.uscis.gov/g-1041a,https://www.uscis.gov/sites/default/files/document/forms/g-1041a.pdf,https://www.uscis.gov/sites/default/files/document/forms/g-1041ainstr.pdf,pdf,Request copies of historical immigration records,Administrative,form-assistance,After completing G-1041 index search
11,G-1055,Fee Schedule,https://www.uscis.gov/g-1055,https://www.uscis.gov/sites/default/files/document/forms/g-1055.pdf,https://www.uscis.gov/sites/default/files/document/forms/g-1055.pdf,pdf,Lists current filing fees for USCIS forms,Administrative,form-assistance,Reference document; not an application
12,G-1145,E-Notification of Application/Petition Acceptance,https://www.uscis.gov/g-1145,https://www.uscis.gov/sites/default/files/document/forms/g-1145.pdf,https://www.uscis.gov/sites/default/files/document/forms/g1145.pdf,pdf,Request for email/text notification of application receipt,Administrative,form-assistance,Optional form for electronic notifications
13,G-1450,Authorization for Credit Card Transactions,https://www.uscis.gov/g-1450,https://www.uscis.gov/sites/default/files/document/forms/g-1450.pdf,https://www.uscis.gov/sites/default/files/document/forms/g-1450.pdf,pdf,Credit card payment form for filing fees,Payment,form-assistance,Alternative to check or money order payment
14,G-28,Notice of Entry of Appearance as Attorney or Accredited Representative,https://www.uscis.gov/g-28,https://www.uscis.gov/sites/default/files/document/forms/g-28.pdf,https://www.uscis.gov/sites/default/files/document/forms/g-28instr.pdf,pdf,Form notifying USCIS of legal representation,Legal Representation,form-assistance,Required when represented by attorney
15,G-325,Biographic Information Form,https://www.uscis.gov/g-325,https://www.uscis.gov/sites/default/files/document/forms/g-325.pdf,https://www.uscis.gov/sites/default/files/document/forms/g-325.pdf,pdf,Basic biographical information,Administrative,form-assistance,Used with certain applications
16,G-325A,Biographic Information,https://www.uscis.gov/g-325a,https://www.uscis.gov/sites/default/files/document/forms/g-325a.pdf,https://www.uscis.gov/sites/default/files/document/forms/g-325a.pdf,pdf,Biographical information for certain applications,Administrative,form-assistance,Updated version of G-325
17,G-639,Freedom of Information/Privacy Act Request,https://www.uscis.gov/g-639,https://www.uscis.gov/sites/default/files/document/forms/g-639.pdf,https://www.uscis.gov/sites/default/files/document/forms/g-639.pdf,pdf,Request for records under FOIA or Privacy Act,Administrative,form-assistance,To obtain copies of immigration records
18,G-884,Request for the Return of Original Documents,https://www.uscis.gov/g-884,https://www.uscis.gov/sites/default/files/document/forms/g-884.pdf,https://www.uscis.gov/sites/default/files/document/forms/g-884.pdf,pdf,Request return of original documents submitted to USCIS,Administrative,form-assistance,For return of valuable original documents
19,I-102,Application for Replacement/Initial Nonimmigrant Arrival-Departure Document,https://www.uscis.gov/i-102,https://www.uscis.gov/sites/default/files/document/forms/i-102.pdf,https://www.uscis.gov/sites/default/files/document/forms/i-102instr.pdf,pdf,For replacement of lost or damaged I-94 record,Documentation,form-assistance,For nonimmigrants needing proof of status
20,I-129,Petition for a Nonimmigrant Worker,https://www.uscis.gov/i-129,https://www.uscis.gov/sites/default/files/document/forms/i-129.pdf,https://www.uscis.gov/sites/default/files/document/forms/i-129instr.pdf,pdf,Filed by employers to bring foreign workers to the U.S. temporarily in various nonimmigrant categories,Nonimmigrant Employment,form-assistance,"Used for H-1B, L-1, O-1 and many other categories"
21,I-129F,Petition for Alien Fiancé(e),https://www.uscis.gov/i-129f,https://www.uscis.gov/sites/default/files/document/forms/i-129f.pdf,https://www.uscis.gov/sites/default/files/document/forms/i-129finstr.pdf,pdf,Used by U.S. citizens to bring fiancé(e)s to the United States for marriage,Family-Based Immigration,form-assistance,Must marry within 90 days of fiancé(e)'s arrival
22,I-129O,Petition for Nonimmigrant Worker: O Classification,https://www.uscis.gov/i-129o,https://www.uscis.gov/sites/default/files/document/forms/i-129o.pdf,https://www.uscis.gov/sites/default/files/document/forms/i-129oinstr.pdf,pdf,"For individuals with extraordinary ability in sciences, arts, education, business or athletics",Nonimmigrant Employment,form-assistance,O-1 visa category specific form
23,I-129S,Nonimmigrant Petition Based on Blanket L Petition,https://www.uscis.gov/i-129s,https://www.uscis.gov/sites/default/files/document/forms/i-129s.pdf,https://www.uscis.gov/sites/default/files/document/forms/i-129sinstr.pdf,pdf,For qualifying L-1 blanket petition beneficiaries,Nonimmigrant Employment,form-assistance,Used with blanket L approvals
24,I-130,Petition for Alien Relative,https://www.uscis.gov/i-130,https://www.uscis.gov/sites/default/files/document/forms/i-130.pdf,https://www.uscis.gov/sites/default/files/document/forms/i-130instr.pdf,pdf,U.S. citizens or permanent residents use this form to establish their relationship with eligible relatives who wish to immigrate to the United States,Family-Based Immigration,form-assistance,First step in family-based immigration process
25,I-130A,Supplemental Information for Spouse Beneficiary,https://www.uscis.gov/i-130a,https://www.uscis.gov/sites/default/files/document/forms/i-130a.pdf,https://www.uscis.gov/sites/default/files/document/forms/i-130ainstr.pdf,pdf,Supplemental form providing additional information about spouse beneficiaries,Family-Based Immigration,form-assistance,Must be submitted with I-130 when petitioning for a spouse
26,I-131,"Application for Travel Documents, Parole Documents, and Arrival/Departure Records",https://www.uscis.gov/i-131,https://www.uscis.gov/sites/default/files/document/forms/i-131.pdf,https://www.uscis.gov/sites/default/files/document/forms/i-131instr.pdf,pdf,Used for various travel documents including Advance Parole and Refugee Travel Document,Travel Documents,form-assistance,Multiple travel document types in one form
27,I-131A,Application for Travel Document (Carrier Documentation),https://www.uscis.gov/i-131a,https://www.uscis.gov/sites/default/files/document/forms/i-131a.pdf,https://www.uscis.gov/sites/default/files/document/forms/i-131ainstr.pdf,pdf,For lawful permanent residents who lost their Green Card while abroad,Travel Documents,form-assistance,Must be filed while outside the United States
28,I-134,Declaration of Financial Support,https://www.uscis.gov/i-134,https://www.uscis.gov/sites/default/files/document/forms/i-134.pdf,https://www.uscis.gov/sites/default/files/document/forms/i-134instr.pdf,pdf,Financial support affidavit for visitors and certain nonimmigrants,Financial Support,form-assistance,Not legally binding like I-864
29,I-140,Immigrant Petition for Alien Worker,https://www.uscis.gov/i-140,https://www.uscis.gov/sites/default/files/document/forms/i-140.pdf,https://www.uscis.gov/sites/default/files/document/forms/i-140instr.pdf,pdf,Employers or self-petitioners use this to request immigrant classification based on employment,Employment-Based Immigration,form-assistance,"For EB-1, EB-2 and EB-3 categories"
30,I-191,Application for Relief Under Former Section 212(c),https://www.uscis.gov/i-191,https://www.uscis.gov/sites/default/files/document/forms/i-191.pdf,https://www.uscis.gov/sites/default/files/document/forms/i-191instr.pdf,pdf,Relief from removal for certain lawful permanent residents,Waivers,form-assistance,Limited applicability after legal changes
31,I-192,Application for Advance Permission to Enter as a Nonimmigrant,https://www.uscis.gov/i-192,https://www.uscis.gov/sites/default/files/document/forms/i-192.pdf,https://www.uscis.gov/sites/default/files/document/forms/i-192instr.pdf,pdf,Permission to enter as nonimmigrant despite inadmissibility,Waivers,form-assistance,For inadmissible nonimmigrants
32,I-193,Application for Waiver of Passport and/or Visa,https://www.uscis.gov/i-193,https://www.uscis.gov/sites/default/files/document/forms/i-193.pdf,https://www.uscis.gov/sites/default/files/document/forms/i-193instr.pdf,pdf,Waiver of passport and visa requirements,Waivers,form-assistance,For emergency circumstances
33,I-20,Certificate of Eligibility for Nonimmigrant Student Status,https://studyinthestates.dhs.gov/student-forms?form=Form_I-20,N/A,N/A,html,For F-1 and M-1 student visa applicants,Nonimmigrant Visa,form-assistance,Issued by educational institutions
34,I-212,Application for Permission to Reapply for Admission After Deportation or Removal,https://www.uscis.gov/i-212,https://www.uscis.gov/sites/default/files/document/forms/i-212.pdf,https://www.uscis.gov/sites/default/files/document/forms/i-212instr.pdf,pdf,Permission to reapply for admission after being deported or removed,Waivers,form-assistance,For those previously deported seeking reentry
35,I-290B,Notice of Appeal or Motion,https://www.uscis.gov/i-290b,https://www.uscis.gov/sites/default/files/document/forms/i-290b.pdf,https://www.uscis.gov/sites/default/files/document/forms/i-290binstr.pdf,pdf,Appeal or motion to reconsider/reopen USCIS decisions,Administrative,form-assistance,For appealing denials on most forms
36,I-360,Petition for Amerasian Widow(er) or Special Immigrant,https://www.uscis.gov/i-360,https://www.uscis.gov/sites/default/files/document/forms/i-360.pdf,https://www.uscis.gov/sites/default/files/document/forms/i-360instr.pdf,pdf,For special immigrants including religious workers and certain abused spouses,Special Immigrants,form-assistance,Multiple special immigrant categories
37,I-407,Record of Abandonment of Lawful Permanent Resident Status,https://www.uscis.gov/i-407,https://www.uscis.gov/sites/default/files/document/forms/i-407.pdf,https://www.uscis.gov/sites/default/files/document/forms/i-407instr.pdf,pdf,Voluntary abandonment of permanent resident status,Documentation,form-assistance,For those who no longer wish to maintain status
38,I-485,Application to Register Permanent Residence or Adjust Status,https://www.uscis.gov/i-485,https://www.uscis.gov/sites/default/files/document/forms/i-485.pdf,https://www.uscis.gov/sites/default/files/document/forms/i-485instr.pdf,pdf,Used to apply for lawful permanent resident status (Green Card) while in the United States,Adjustment of Status,form-assistance user-experience-mining,Can be filed concurrently with certain petition forms
39,I-485 Supplement A,Adjustment of Status Under Section 245(i),https://www.uscis.gov/i-485supa,https://www.uscis.gov/sites/default/files/document/forms/i-485supa.pdf,https://www.uscis.gov/sites/default/files/document/forms/i-485supainstr.pdf,pdf,For adjustment applicants under special 245(i) provisions,Adjustment of Status,form-assistance,Includes penalty fee payment
40,I-485 Supplement J,Confirmation of Bona Fide Job Offer or Request for Job Portability,https://www.uscis.gov/i-485supj,https://www.uscis.gov/sites/default/files/document/forms/i-485supj.pdf,https://www.uscis.gov/sites/default/files/document/forms/i-485supjinstr.pdf,pdf,Confirms job offer in I-140 remains valid or requests job portability,Employment-Based Immigration,form-assistance,Used with employment-based adjustment applications
41,I-508,"Waiver of Rights, Privileges, Exemptions and Immunities",https://www.uscis.gov/i-508,https://www.uscis.gov/sites/default/files/document/forms/i-508.pdf,https://www.uscis.gov/sites/default/files/document/forms/i-508instr.pdf,pdf,Waiver of diplomatic rights for A or G nonimmigrants who want to adjust status,Diplomatic,form-assistance,Required for certain diplomats seeking green cards
42,I-526,Immigrant Petition by Standalone Investor,https://www.uscis.gov/i-526,https://www.uscis.gov/sites/default/files/document/forms/i-526.pdf,https://www.uscis.gov/sites/default/files/document/forms/i-526instr.pdf,pdf,For EB-5 investors not associated with a regional center,Investment-Based Immigration,form-assistance,EB-5 direct investment program
43,I-526E,Immigrant Petition by Regional Center Investor,https://www.uscis.gov/i-526e,https://www.uscis.gov/sites/default/files/document/forms/i-526e.pdf,https://www.uscis.gov/sites/default/files/document/forms/i-526einstr.pdf,pdf,For EB-5 investors associated with a regional center,Investment-Based Immigration,form-assistance,EB-5 regional center program
44,I-539,Application to Extend/Change Nonimmigrant Status,https://www.uscis.gov/i-539,https://www.uscis.gov/sites/default/files/document/forms/i-539.pdf,https://www.uscis.gov/sites/default/files/document/forms/i-539instr.pdf,pdf,Request to extend stay or change to a different nonimmigrant status,Nonimmigrant Status,form-assistance,"For tourists, students and other nonimmigrants"
45,I-566,Interagency Record of Request,https://www.uscis.gov/i-566,https://www.uscis.gov/sites/default/files/document/forms/i-566.pdf,https://www.uscis.gov/sites/default/files/document/forms/i-566instr.pdf,pdf,"For A, G or NATO nonimmigrants requesting change/adjustment of status",Diplomatic,form-assistance,Requires endorsement from Department of State
46,I-570,Application for Issuance or Replacement of Northern Mariana Card,https://www.uscis.gov/i-570,https://www.uscis.gov/sites/default/files/document/forms/i-570.pdf,https://www.uscis.gov/sites/default/files/document/forms/i-570instr.pdf,pdf,For Northern Mariana Islands certificate of identity,Documentation,form-assistance,Limited applicability for CNMI residents
47,I-589,Application for Asylum and for Withholding of Removal,https://www.uscis.gov/i-589,https://www.uscis.gov/sites/default/files/document/forms/i-589.pdf,https://www.uscis.gov/sites/default/files/document/forms/i-589instr.pdf,pdf,Application for asylum based on fear of persecution,Humanitarian,form-assistance,Generally must file within one year of arrival
48,I-600,Petition to Classify Orphan as an Immediate Relative,https://www.uscis.gov/i-600,https://www.uscis.gov/sites/default/files/document/forms/i-600.pdf,https://www.uscis.gov/sites/default/files/document/forms/i-600instr.pdf,pdf,Petition to adopt a child from a non-Hague Convention country,Adoption,form-assistance,For non-Hague Convention adoptions
49,I-600A,Application for Advance Processing of an Orphan Petition,https://www.uscis.gov/i-600a,https://www.uscis.gov/sites/default/files/document/forms/i-600a.pdf,https://www.uscis.gov/sites/default/files/document/forms/i-600ainstr.pdf,pdf,Application to be found suitable to adopt from non-Hague countries,Adoption,form-assistance,First step in non-Hague adoption process
50,I-601,Application for Waiver of Grounds of Inadmissibility,https://www.uscis.gov/i-601,https://www.uscis.gov/sites/default/files/document/forms/i-601.pdf,https://www.uscis.gov/sites/default/files/document/forms/i-601instr.pdf,pdf,Waiver of certain grounds that would prevent admission to the U.S.,Waivers,form-assistance,Various inadmissibility grounds may be waived
51,I-601A,Application for Provisional Unlawful Presence Waiver,https://www.uscis.gov/i-601a,https://www.uscis.gov/sites/default/files/document/forms/i-601a.pdf,https://www.uscis.gov/sites/default/files/document/forms/i-601ainstr.pdf,pdf,Waiver for unlawful presence before departing for immigrant visa interview,Waivers,form-assistance,Reduces time separated from family members
52,I-602,Application by Refugee for Waiver of Inadmissibility Grounds,https://www.uscis.gov/i-602,https://www.uscis.gov/sites/default/files/document/forms/i-602.pdf,https://www.uscis.gov/sites/default/files/document/forms/i-602instr.pdf,pdf,Waiver of inadmissibility for refugees,Humanitarian,form-assistance,For refugees with inadmissibility issues
53,I-612,Application for Waiver of the Foreign Residence Requirement,https://www.uscis.gov/i-612,https://www.uscis.gov/sites/default/files/document/forms/i-612.pdf,https://www.uscis.gov/sites/default/files/document/forms/i-612instr.pdf,pdf,Waiver of two-year home residence requirement for J-1 visa holders,Waivers,form-assistance,Required for certain J visa holders to adjust status
54,I-643,Health and Human Services Statistical Data for Refugee/Asylee Adjusting Status,https://www.uscis.gov/i-643,https://www.uscis.gov/sites/default/files/document/forms/i-643.pdf,https://www.uscis.gov/sites/default/files/document/forms/i-643.pdf,pdf,Statistical data collection for refugee/asylee adjustment,Administrative,form-assistance,Submitted with refugee/asylee I-485
55,I-644,Supplementary Statement for Application for Naturalization,https://www.uscis.gov/i-644,https://www.uscis.gov/sites/default/files/document/forms/i-644.pdf,https://www.uscis.gov/sites/default/files/document/forms/i-644.pdf,pdf,Additional information for naturalization applications,Citizenship and Naturalization,form-assistance,Used in specific circumstances
56,I-687,Application for Status as a Temporary Resident,https://www.uscis.gov/i-687,https://www.uscis.gov/sites/default/files/document/forms/i-687.pdf,https://www.uscis.gov/sites/default/files/document/forms/i-687instr.pdf,pdf,For legalization applicants under Immigration Reform and Control Act,Legalization,form-assistance,Limited applicability today
57,I-690,Application for Waiver of Grounds of Inadmissibility,https://www.uscis.gov/i-690,https://www.uscis.gov/sites/default/files/document/forms/i-690.pdf,https://www.uscis.gov/sites/default/files/document/forms/i-690instr.pdf,pdf,Waiver for certain legalization applicants,Waivers,form-assistance,Used with I-687 and related applications
58,I-693,Report of Medical Examination and Vaccination Record,https://www.uscis.gov/i-693,https://www.uscis.gov/sites/default/files/document/forms/i-693.pdf,https://www.uscis.gov/sites/default/files/document/forms/i-693instr.pdf,pdf,Medical examination for adjustment of status applicants,Medical,form-assistance,Must be completed by designated civil surgeon
59,I-694,Notice of Appeal of Decision Under Section 210 or 245A,https://www.uscis.gov/i-694,https://www.uscis.gov/sites/default/files/document/forms/i-694.pdf,https://www.uscis.gov/sites/default/files/document/forms/i-694instr.pdf,pdf,Appeal form for legalization decisions,Administrative,form-assistance,Limited applicability for legalization programs
60,I-698,Application to Adjust Status From Temporary to Permanent Resident,https://www.uscis.gov/i-698,https://www.uscis.gov/sites/default/files/document/forms/i-698.pdf,https://www.uscis.gov/sites/default/files/document/forms/i-698instr.pdf,pdf,For legalization applicants to adjust to permanent residence,Adjustment of Status,form-assistance,Limited applicability for legalization program
61,I-730,Refugee/Asylee Relative Petition,https://www.uscis.gov/i-730,https://www.uscis.gov/sites/default/files/document/forms/i-730.pdf,https://www.uscis.gov/sites/default/files/document/forms/i-730instr.pdf,pdf,Petition to bring spouse and children of refugees and asylees to the U.S.,Humanitarian,form-assistance,Must file within two years of refugee/asylee status
62,I-751,Petition to Remove Conditions on Residence,https://www.uscis.gov/i-751,https://www.uscis.gov/sites/default/files/document/forms/i-751.pdf,https://www.uscis.gov/sites/default/files/document/forms/i-751instr.pdf,pdf,To remove conditional status obtained through marriage,Family-Based Immigration,form-assistance,Submit 90 days before conditional residence expires
63,I-765,Application for Employment Authorization,https://www.uscis.gov/i-765,https://www.uscis.gov/sites/default/files/document/forms/i-765.pdf,https://www.uscis.gov/sites/default/files/document/forms/i-765instr.pdf,pdf,Used to apply for work authorization and Employment Authorization Document (EAD),Employment Authorization,form-assistance,Required for many categories to legally work in the U.S.
64,I-777,Application for Issuance or Replacement of Northern Mariana Card,https://www.uscis.gov/i-777,https://www.uscis.gov/sites/default/files/document/forms/i-777.pdf,https://www.uscis.gov/sites/default/files/document/forms/i-777instr.pdf,pdf,For Northern Mariana Islands residents,Documentation,form-assistance,Very limited applicability
65,I-800,Petition to Classify Convention Adoptee as an Immediate Relative,https://www.uscis.gov/i-800,https://www.uscis.gov/sites/default/files/document/forms/i-800.pdf,https://www.uscis.gov/sites/default/files/document/forms/i-800instr.pdf,pdf,Petition to adopt a child from a Hague Convention country,Adoption,form-assistance,For Hague Convention adoptions
66,I-800A,Application for Determination of Suitability to Adopt a Child from a Convention Country,https://www.uscis.gov/i-800a,https://www.uscis.gov/sites/default/files/document/forms/i-800a.pdf,https://www.uscis.gov/sites/default/files/document/forms/i-800ainstr.pdf,pdf,Application to be found suitable to adopt from Hague countries,Adoption,form-assistance,First step in Hague adoption process
67,I-817,Application for Family Unity Benefits,https://www.uscis.gov/i-817,https://www.uscis.gov/sites/default/files/document/forms/i-817.pdf,https://www.uscis.gov/sites/default/files/document/forms/i-817instr.pdf,pdf,Protection from removal for certain family members of legalized immigrants,Humanitarian,form-assistance,Under Immigration Act of 1990
68,I-821,Application for Temporary Protected Status,https://www.uscis.gov/i-821,https://www.uscis.gov/sites/default/files/document/forms/i-821.pdf,https://www.uscis.gov/sites/default/files/document/forms/i-821instr.pdf,pdf,For nationals of designated countries to apply for temporary protection in the U.S.,Humanitarian,form-assistance,For citizens of countries with ongoing crises
69,I-821D,Consideration of Deferred Action for Childhood Arrivals,https://www.uscis.gov/i-821d,https://www.uscis.gov/sites/default/files/document/forms/i-821d.pdf,https://www.uscis.gov/sites/default/files/document/forms/i-821dinstr.pdf,pdf,Request for DACA status,Humanitarian,form-assistance,For certain individuals who came to U.S. as children
70,I-824,Application for Action on an Approved Application or Petition,https://www.uscis.gov/i-824,https://www.uscis.gov/sites/default/files/document/forms/i-824.pdf,https://www.uscis.gov/sites/default/files/document/forms/i-824instr.pdf,pdf,Request for duplicate approval notice or other actions on approved applications,Administrative,form-assistance,Multiple administrative actions available
71,I-829,Petition by Entrepreneur to Remove Conditions on Permanent Resident Status,https://www.uscis.gov/i-829,https://www.uscis.gov/sites/default/files/document/forms/i-829.pdf,https://www.uscis.gov/sites/default/files/document/forms/i-829instr.pdf,pdf,Remove conditions from EB-5 investor green card,Investment-Based Immigration,form-assistance,Must demonstrate investment requirements met
